title,doi,abstract,year,publication_date,cited_by_count,authors,affiliations,topics,source_display_name,type_crossref,researcher,author_id,queried_dataset_terms,matched_dataset_terms,location,best_match_idx,best_match_title,best_match_score
The Unbundling of Advertising Agency Services: An Economic Analysis,https://doi.org/10.1515/1546-5616.1164,"Abstract We address a puzzle surrounding the shift from bundling to unbundling of U.S. advertising agency services and the slow pace of change over several decades. We model an agency’s decision as a tradeoff between the fixed cost to the advertiser of establishing a relationship with an agency and pecuniary economies of scale from media services provision. Using micro-data from the U.S. Census of Services for 1982-2007, we find agencies are more likely to unbundle with increasing size, diversification and higher media prices, and less likely with increasing age, larger media volume, and an interaction between media prices and volume.",2012,2012-12-03,8,"{'Alvin J. Silk', 'Mohammad Arzaghi', 'James C. Davis', 'Ernst R. Berndt'}",,Digital Platforms and Economics; Consumer Market Behavior and Pricing; Merger and Competition Analysis,Review of Marketing Science,article,Ernst R Berndt,https://openalex.org/A5003148701,Census Bureau; Census of Services; Standard Statistical Establishment List - non Name and Address File,Census of Services,Boston,393,The Unbundling of Advertising Agency Services: An Economic Analysis,100
Predictive Analytics and Organizational Architecture: Plant-Level Evidence from Census Data,,"We examine trends in the use of predictive analytics for a sample of more than 25,000 manufacturing plants using proprietary data from the US Census Bureau. Comparing 2010 and 2015, we find that use of predictive analytics has increased markedly, with the greatest use in younger plants, professionally-managed firms, more educated workforces, and stable industries. Decisions on data to be gathered originate from headquarters and are associated with less delegation of decision-making and more widespread awareness of quantitative targets among plant employees. Performance targets become more accurate, long-term oriented, and linked to company-wide performance, and management incentives strengthen, both in terms of monetary bonuses and career outcomes. Plants increasing predictive analytics become more efficient, with lower inventory, increased volume of shipments, narrower product mix, reduced management payroll and increased use of flexible and temporary employees. Results are robust to a specification based on increased government demand for data.",2019,2019-01-01,0,"{'Mark H. Lang', 'Eva Labro', 'Jim Omartian'}",,Big Data and Business Intelligence,RePEc: Research Papers in Economics,preprint,Eva Labro,https://openalex.org/A5075600439,Census Bureau,Census Bureau,Triangle,1235,Predictive Analytics and Organizational Architecture: Plant-Level Evidence from Census Data,100
Brighter Prospects? Assessing the Franchise Advantage using Census Data,,"This paper uses Census micro data to examine how starting a business as a franchise rather than an independent business affects its survival and growth prospects. We first consider the factors that influence the business owner's decision about being franchised, and then use different empirical approaches to correct for selection bias in our performance analyses. We find that franchised businesses on average benefit from higher survival rates and faster initial growth relative to independent businesses. However, the effects are not large and, conditional on first-year survival, the differences basically disappear. We briefly discuss potential mechanisms to explain these results. U.S. Census Bureau. All results have been reviewed to ensure that no confidential information is disclosed. Support for this research at the Michigan Census Research Data Center is gratefully acknowledged.",2017,2017-01-01,0,"{'Francine Lafontaine', 'Xu Zhang', 'Marek Zapletal'}",Centre for Economic Policy Research; Ross School; University of Michigan–Ann Arbor; London Business School,Franchising Strategies and Performance; Livestock Management and Performance Improvement,RePEc: Research Papers in Economics,preprint,Francine Lafontaine,https://openalex.org/A5035418329,NBER-CES Manufacturing Industry Database (Public Use Dataset); Commodity Flow Survey; Census Bureau,Census Bureau,Michigan,759,Brighter Prospects? Assessing the Franchise Advantage using Census Data,100
Restructuring of the Financial Industry and Implications for Sources of Start-Up Capital for New Businesses in Nonmetropolitan Counties *,,"Historically, in small towns throughout rural America local banks had formed symbiotic relationships with local businesses. The flow of capital was lubricated by the personal relationships and trust that developed between local banks and business owners. However, over the past 20 years changes in interstate banking laws have led to a flurry of mergers and acquisitions resulting in a national consolidation of bank firms.1 This consolidation was followed by a proliferation of establishments at the local level, many of which were former independent and regional banks that serviced local businesses (Boot 2011; Devaney and Weber 1995; Berger and Udell 1995; Berger and Black 2007). Issues affecting the sources of financing are of interest to rural sociologists (Green 1984; 1986). At the core of research on civic community and socioeconomic well-being in rural communities is a strong, independent middle class consisting of local leaders, entrepreneurs, and local small business owners (Tolbert, Lyson, and Irwin 1998; Blanchard, Tolbert and Mencken 2012; Tolbert et al. 2002). Entrepreneurs need start-up capital to launch a new business. Likewise, current local business owners need access to capital to keep their businesses functioning, and to expand their operations (Davis, Haltiwanger, and Jarmin 2008; Black and Strahan 2002).In this research note we provide descriptive analyses of sources of financing for new business start-ups in nonmetropolitan counties using data from the 2007 Survey of Business Owners and Self-Employed Persons (SBO). We present data on the sources of start-up capital for new business in nonmetropolitan counties and propose that there is a distinct decline in the use of bank loans over the decades. We also document a potential increase in use of riskier alternative sources, including credit cards over the past 30 years. Our analysis is unique in that we use confidential tabulations of the 2007 SBO at the Census Research Data Center to compare nonmetropolitan businesses with metropolitan businesses and publically available national trends.2At issue are the implications of changes in banking laws, such as the 1994 Riegle-Neal Interstate Banking Act, beyond merger and acquisitions, and improvements in communications technology (Whaling 1996; Cetorelli and Strahan 2006), that have led to firm-level consolidation in traditional financial services industry over the last 30 years. While many believe that this has increased access to customers and capital for some, there are potentially significant implications for businesses started by local entrepreneurs (De Young, Glennon, and Nigro 2008; Kilkenny 2002; Shaffer and Collender 2008).BACKGROUNDThe banking industry has been one of the most regulated industries in the United States. Before 1994, local banks were protected against interstate and intrastate competition, as state legislatures decided which banks could establish branches and subsidiaries within the state. At the federal level, the banking industry was governed by two important pieces of legislation: the McFadden Act of 1927 and the 1956 Bank Holding Company Act. These laws put severe restrictions on interstate banking, and the 1956 Bank Holding Company Act required that all bank holding companies (BHCs) fall under the supervision of the Board of Governors of the Federal Reserve System (Omarova and Tahyar 2011).3 The 1956 legislation was intended to limit the spatial expansion of large banking groups and their monopolization of local credit markets. However, many BHCs managed to circumvent the interstate restrictions. In 1993, 42 states still prohibited interstate banking, but there was considerable interstate banking activity, just done extremely inefficiently (Nippani and Green 2002; Zou, Miller and Malamud 2011).The 1994 Riegle-Neal Interstate Banking and Branching Efficiency Act sought to remove the inefficiencies and ease the interstate banking restrictions. The impact was argued to be beneficial for banks, businesses, and consumers. …",2016,2016-01-01,7,"{'F. Carson Mencken', 'Charles M. Tolbert'}",,"Migration, Ethnicity, and Economy; Cooperative Studies and Economics; Banking stability, regulation, efficiency",Journal of Rural Social Sciences,article,Frederick Mencken,https://openalex.org/A5004078264,Kauffman Firm Survey; Survey of Business Owners; Annual Business Survey; Disclosure Avoidance Population Tables,Survey of Business Owners,Texas,1122,Restructuring of the Financial Industry and Implications for Sources of Start-up Capital for New Businesses in Nonmetropolitan Counties,100
Preliminary Analysis of the Distributions of Carbon and Energy Intensity for 27 Energy Intensive Trade Exposed Industrial Sectors,https://doi.org/10.2139/ssrn.1925133,"It is well documented that different manufacturing sectors require different amounts of energy. Primary materials conversion, e.g., iron ore and scrap into steel, limestone and sand into cement and glass, or wood and other fibers into paper, tend to be the most energy-intensive in the production process, while final consumer products like electronics and clothing require the least energy. This leads to something like the 80-20 rule, where a large portion of energy use is in a small number of industries. For example, the 2006 Manufacturing Energy Consumption Survey (MECS) reported that 75 percent of fuel use arises from only five of the 21 three-digit industries, using the North American Industry Classification System (NAICS). These five sectors are a small share of the total U.S. economy. The energy intensity for different industrial sectors is easily measured using published government statistics, but the plants within these industries are not homogeneous entities. This report measures the differences in energy use and associated CO2 emissions as a first step to understanding the within-sector heterogeneity of energy use.",2011,2011-01-01,1,"{'Béla Személy', 'Tatyana Kuzmenko', 'Gang Zhang', 'Gale Boyd'}",Duke University; Office of the Comptroller of the Currency; Boston University; Quest University Canada,"Environmental Impact and Sustainability; Energy, Environment, and Transportation Policies; Vehicle emissions and performance",SSRN Electronic Journal,article,Gale A Boyd,https://openalex.org/A5058981904,Supplementary Public Data - Industry and Product Codes; Census of Mining; Manufacturing Energy Consumption Survey,Manufacturing Energy Consumption Survey,Triangle,422,Preliminary Analysis of the Distributions of Carbon and Energy Intensity for 27 Energy Intensive Trade Exposed Industrial Sectors,100
File Matching with Faulty Continuous Matching Variables,,"We present LFCMV, a Bayesian file linking methodology designed to link records using continuous matching variables in situations where we do not expect values of these matching variables to agree exactly across matched pairs. The method involves a linking model for the distance between the matching variables of records in one file and the matching variables of their linked records in the second. This linking model is conditional on a vector indicating the links. We specify a mixture model for the distance component of the linking model, as this latent structure allows the distance between matching variables in linked pairs to vary across types of linked pairs. Finally, we specify a model for the linking vector. We describe the Gibbs sampling algorithm for sampling from the posterior distribution of this linkage model and use artificial data to illustrate model performance. We also introduce a linking application using public survey information and data from the U.S. Census of Manufactures and use LFCMV to link the records.",2017,2017-01-01,0,"{'Nicole M. Dalzell', 'Jerome P. Reiter', 'Gale Boyd'}",,Bayesian Methods and Mixture Models; Data Quality and Management; Census and Population Estimation,RePEc: Research Papers in Economics,preprint,Gale A Boyd,https://openalex.org/A5058981904,Census of Transportation Communications and Utilities; LEHD Geocoded Address List (GAL) - 2004; Census of Manufactures,Census of Manufactures,Triangle,1168,File Matching with Faulty Continuous Matching Variables,100
The Energy Efficiency Gap and Energy Price Responsiveness in Food Processing,,"This paper estimates stochastic frontier energy demand functions with non-public, plant-level data from the U.S. Census Bureau to measure the energy efficiency gap and energy price elasticities in the food processing industry. The estimates are for electricity and fuel use in 4 food processing sectors, based on the disaggregation of this industry used by the National Energy Modeling System Industrial Demand Module. The estimated demand functions control for plant inputs and output, energy prices, and other observables including 6-digit NAICS industry designations. Own price elasticities range from 0.6 to -0.9 with little evidence of fuel/electricity substitution. The magnitude of the efficiency estimates is sensitive to the assumptions but consistently reveal that few plants achieve 100% efficiency. Defining a “practical level of energy efficiency” as the 95th percentile of the efficiency distributions and averaging across all the models result in a ~20% efficiency gap. However, most of the potential reductions in energy use from closing this efficiency gap are from plants that are “low hanging fruit”; 13% of the 20% potential reduction in the efficiency gap can be obtained by bringing the lower half of the efficiency distribution up to just the median level of observed performance. New plants do exhibit higher energy efficiency than existing plants which is statistically significant, but the difference is small for most of the industry; ranging from a low of 0.4% to a high of 5.7%.",2020,2020-06-01,3,"{'Matt Doolin', 'Gale Boyd'}",,"Energy Efficiency and Management; Environmental Impact and Sustainability; Energy, Environment, and Transportation Policies",RePEc: Research Papers in Economics,preprint,Gale A Boyd,https://openalex.org/A5058981904,Survey of Plant Capacity Utilization; Census Bureau,Census Bureau,Triangle,1582,The Energy Efficiency Gap and Energy Price Responsiveness in Food Processing,100
Intergenerational Mobility and Credit,https://doi.org/10.3386/w32031,"We combine the Decennial Census, credit reports, and administrative earnings to create the first panel dataset linking parent's credit access to the labor market outcomes of children in the U.S. We find that a 10% increase in parent's unused revolving credit during their children's adolescence (13 to 18 years old) is associated with 0.28% to 0.37% greater labor earnings of their children during early adulthood (25 to 30 years old).Using these empirical elasticities, we estimate a dynastic, defaultable debt model to examine how the democratization of credit since the 1970s -modeled as both greater credit limits and more lenient bankruptcy -affected intergenerational mobility.Surprisingly, we find that the democratization of credit led to less intergenerational mobility and greater inequality.Two offsetting forces underlie this result: (1) greater credit limits raise mobility by facilitating borrowing and investment among low-income households; (2) however, more lenient bankruptcy policy lowers mobility since low-income households dissave, hit their constraints more often, and reduce investments in their children.Quantitatively, the democratization of credit is dominated by more lenient bankruptcy policy and so mobility declines between the 1970s and 2000s.",2024,2024-01-01,3,"{'Nisha Chikhale', 'J. Carter Braxton', 'Kyle Herkenhoff', 'Gordon Phillips'}",National Bureau of Economic Research; National Bureau of Economic Research; University of Minnesota; National Bureau of Economic Research; Dartmouth College; National Bureau of Economic Research,"Migration, Ethnicity, and Economy; Migration, Aging, and Tourism Studies; Housing, Finance, and Neoliberalism",,report,Gordon M Phillips,https://openalex.org/A5068926411,LEHD Employer-Level File T26 (ECF; T26); BOC Census Numident (CNUM); Decennial Census,Decennial Census,USC,1467,Intergenerational Mobility and Credit,100
Intergenerational Mobility and Credit,https://doi.org/10.2139/ssrn.4741452,"We combine the Decennial Census, credit reports, and administrative earnings to create the first panel dataset linking parent's credit access to the labor market outcomes of children in the U.S.We find that a 10% increase in parent's unused revolving credit during their children's adolescence (13 to 18 years old) is associated with 0.28% to 0.37% greater labor earnings of their children during early adulthood (25 to 30 years old). Using these empirical elasticities, we estimate a dynastic, defaultable debt model to examine how the democratization of credit since the 1970s – modeled as both greater credit limits and more lenient bankruptcy – affected intergenerational mobility. Surprisingly, we find that the democratization of credit led to less intergenerational mobility and greater inequality. Two offsetting forces underlie this result: (1) greater credit limits raise mobility by facilitating borrowing and investment among low-income households; (2) however, more lenient bankruptcy policy lowers mobility since low-income households dissave, hit their constraints more often, and reduce investments in their children. Quantitatively, the democratization of credit is dominated by more lenient bankruptcy policy and so mobility declines between the 1970s and 2000s.",2024,2024-01-01,2,"{'Nisha Chikhale', 'J. Carter Braxton', 'Kyle Herkenhoff', 'Gordon Phillips'}",University of Wisconsin–Parkside; University of Wisconsin–Madison; University of Minnesota System; Dartmouth College; Dartmouth Hospital,"Migration, Ethnicity, and Economy; Migration, Aging, and Tourism Studies; Housing, Finance, and Neoliberalism",SSRN Electronic Journal,article,Gordon M Phillips,https://openalex.org/A5068926411,LEHD Employer-Level File T26 (ECF; T26); BOC Census Numident (CNUM); Decennial Census,Decennial Census,USC,1467,Intergenerational Mobility and Credit,100
Intergenerational Mobility and Credit,https://doi.org/10.2139/ssrn.4694943,"We combine the Decennial Census, credit reports, and administrative earnings to create the first panel dataset linking parent’s credit access to the labor market outcomes of children in the U.S. We find that a 10% increase in parent’s unused revolving credit during their children’s adolescence (13 to 18 years old) is associated with 0.28% to 0.37% greater labor earnings of their children during early adulthood (25 to 30 years old). Using these empirical elasticities, we estimate a dynastic, defaultable debt model to examine how the democratization of credit since the 1970s – modeled as both greater credit limits and more lenient bankruptcy – affected intergenerational mobility. Surprisingly, we find that the democratization of credit led to less intergenerational mobility and greater inequality. Two offsetting forces underlie this result: (1) greater credit limits raise mobility by facilitating borrowing and investment among low-income households; (2) however, more lenient bankruptcy policy lowers mobility since low-income households dissave, hit their constraints more often, and reduce investments in their children. Quantitatively, the democratization of credit is dominated by more lenient bankruptcy policy and so mobility declines between the 1970s and 2000s.Institutional subscribers to the NBER working paper series, and residents of developing countries may download this paper without additional charge at www.nber.org.",2024,2024-01-01,0,"{'Nisha Chikhale', 'J. Carter Braxton', 'Kyle Herkenhoff', 'Gordon Phillips'}",University of Wisconsin–Parkside; University of Wisconsin–Parkside; University of Minnesota System; Dartmouth College; National Bureau of Economic Research,"Financial Literacy, Pension, Retirement Analysis; Intergenerational and Educational Inequality Studies; Housing, Finance, and Neoliberalism",SSRN Electronic Journal,article,Gordon M Phillips,https://openalex.org/A5068926411,LEHD Employer-Level File T26 (ECF; T26); BOC Census Numident (CNUM); Decennial Census,Decennial Census,USC,1467,Intergenerational Mobility and Credit,100
Human Capital Loss in Corporate Bankruptcy,https://doi.org/10.2139/ssrn.2306130,"This paper quantifies the “human costs of bankruptcy” by estimating employee wage losses induced by the bankruptcy filing of employers using employee-employer matched data from the U.S. Census Bureau’s LEHD program. We find that employee wages begin to deteriorate one year prior to bankruptcy. One year after bankruptcy, the magnitude of the decline in annual wages is 30% of pre-bankruptcy wages. The decrease in wages persists (at least) for five years post-bankruptcy. The present value of wage losses summed up to five years after bankruptcy amounts to 29-49% of the average pre-bankruptcy market value of firm. Furthermore, we find that the ex-ante wage premium to compensate for the ex-post wage loss due to bankruptcy can be of similar magnitude with that of the tax benefits of debt.",2013,2013-01-01,11,"{'Hyunseob Kim', 'John R. Graham', 'Si Li', 'Jiaping Qiu'}",Duke University; National Bureau of Economic Research; Federal Reserve Bank of Chicago; Wilfrid Laurier University; McMaster University,Corporate Insolvency and Governance; Corporate Finance and Governance; Financial Reporting and Valuation Research,SSRN Electronic Journal,article,Hyunseob Kim,https://openalex.org/A5060559212,Service Annual Survey; Foreign Trade Data - Import; Census Bureau,Census Bureau,Triangle,631,Human Capital Loss in Corporate Bankruptcy,100
"Home Equity Lending, Credit Constraints and Small Business in the US",https://doi.org/10.2139/ssrn.3655661,"We use Texas's constitutional amendment in 1997 that expanded the scope of home equity loans as a source of exogenous variation to estimate the effects of relaxing credit constraints on small businesses. We find, using standard panel data methods and restricted-use micro-data from the US Census Bureau, that the Texas amendment increased the use of home equity finance by small businesses, increased new business and job creation and reduced establishment exit and job loss. The effects are larger and significant for businesses with fewer than ten employees.",2020,2020-01-01,1,"{'Ian M. Schmutte', 'Thor Watson', 'William D. Lastrapes'}",University of Georgia; University of Georgia; University of Georgia,"Financial Literacy, Pension, Retirement Analysis; Migration, Ethnicity, and Economy; Housing, Finance, and Neoliberalism",SSRN Electronic Journal,article,Ian M Schmutte,https://openalex.org/A5033347166,Standard Statistical Establishment Listing; Survey of Business Owners; Census Bureau,Census Bureau,Atlanta,858,"Home Equity Lending, Credit Constraints and Small Business in the US.",100
A Comparison of Firm Age in the Survey of Business Owners and the Longitudinal Business Database,,"In this note, we use restricted-access data from the 1992 Characteristics of Business Owners (CBO) and the 2002 and 2007 Surveys of Business Owners (SBO) that are linked to the Longitudinal Business Database (LBD) and compare how firm age is reported across sources. Our analysis shows considerable agreement between administrative and survey measures. However, we also find meaningful discrepancies. The SBO measures generally suggest an earlier date of founding than is revealed in the LBD. For researchers, caution should be taken when using these sources in studies that rely on a particular interpretation of the firm age measure.",2020,2020-12-01,0,"{'Ian M. Schmutte', 'Thor Watson', 'William D. Lastrapes'}",,Labor market dynamics and wage inequality; Firm Innovation and Growth,RePEc: Research Papers in Economics,preprint,Ian M Schmutte,https://openalex.org/A5033347166,Standard Statistical Establishment Listing; Survey of Business Owners; Census Bureau,Survey of Business Owners,Atlanta,857,A Comparison of Firm Age in the Survey of Business Owners and the Longitudinal Business Database,100
A Comparison of Firm Age in the Survey of Business Owners and the Longitudinal Business Database,,"In this note, we use restricted-access data from the 1992 Characteristics of Business Owners (CBO) and the 2002 and 2007 Surveys of Business Owners (SBO) that are linked to the Longitudinal Business Database (LBD) and compare how firm age is reported across sources. Our analysis shows considerable agreement between administrative and survey measures. However, we also find meaningful discrepancies. The SBO measures generally suggest an earlier date of founding than is revealed in the LBD. For researchers, caution should be taken when using these sources in studies that rely on a particular interpretation of the firm age measure.",2020,2020-01-01,0,"{'Ian M. Schmutte', 'Thor Watson', 'William D. Lastrapes'}",,Labor market dynamics and wage inequality; Firm Innovation and Growth,,article,Ian M Schmutte,https://openalex.org/A5033347166,Standard Statistical Establishment Listing; Survey of Business Owners; Census Bureau,Survey of Business Owners,Atlanta,857,A Comparison of Firm Age in the Survey of Business Owners and the Longitudinal Business Database,100
