title,doi,abstract,year,publication_date,cited_by_count,authors,affiliations,topics,source_display_name,type_crossref,researcher,author_id,queried_dataset_terms,matched_dataset_terms,location,best_match_idx,best_match_title,best_match_score
Reservation Nonemployer and Employer Establishments: Data from U.S. Census Longitudinal Business Databases,,"The presence of businesses on American Indian reservations has been difficult to analyze due to limited data. Akee, Mykerezi, and Todd (AMT; 2017) geocoded confidential data from the U.S. Census Longitudinal Business Database to identify whether employer establishments were located on or off American Indian reservations and then compared federally recognized reservations and nearby county areas with respect to their per capita number of employers and jobs. We use their methods and the U.S. Census Integrated Longitudinal Business Database to develop parallel results for nonemployer establishments and for the combination of employer and nonemployer establishments. Similar to AMT’s findings, we find that reservations and nearby county areas have a similar sectoral distribution of nonemployer and nonemployer-plus-employer establishments, but reservations have significantly fewer of them in nearly all sectors, especially when the area population is below 15,000. By contrast to AMT, the average size of reservation nonemployer establishments, as measured by revenue (instead of the jobs measure AMT used for employers), is smaller than the size of nonemployers in nearby county areas, and this is true in most industries as well. The most significant exception is in the retail sector. Geographic and demographic factors, such as population density and per capita income, statistically account for only a small portion of these differences. However, when we assume that nonemployer establishments create the equivalent of one job and use combined employer-plus-nonemployer jobs to measure establishment size, the employer job numbers dominate and we parallel AMT’s finding that, due to large job counts in the Arts/Entertainment/Recreation and Public Administration sectors, reservations on average have slightly more jobs per resident than nearby county areas.",2018,2018-12-01,0,"{'Elton Mykerezi', 'Richard M. Todd', 'Randall Akee'}",,"Migration, Ethnicity, and Economy; Sharing Economy and Platforms; Urban, Neighborhood, and Segregation Studies",RePEc: Research Papers in Economics,preprint,Richard M Todd,https://openalex.org/A5111929278,Integrated Longitudinal Business Database; Standard Statistical Establishment List - non Name and Address File,Integrated Longitudinal Business Database,Minnesota,807,Reservation Nonemployer and Employer Establishments: Data from U.S. Census Longitudinal Business Databases,100
"Black Pioneers, Intermetropolitan Movers, and Housing Desegregation",https://doi.org/10.2139/ssrn.2757766,"In this project, we examine the mobility choices of black households between 1960 and 2000. We use household-level Decennial Census data geocoded down to the census tract level. Our results indicate that, for black households, one’s status as an intermetropolitan migrant – especially from an urban area outside the South – is a powerful predictor of pioneering into a white neighborhood. Moreover, and perhaps even more importantly, the ratio of these intermetropolitan black arrivals to the incumbent metropolitan black population is a powerful predictor of whether a metropolitan area experiences substantial declines in housing segregation.",2016,2016-01-01,2,"{'Richard H. Sander', 'Yana A. Kucheva'}","City College of New York; University of California, Los Angeles","Urban, Neighborhood, and Segregation Studies; Housing Market and Economics; Regional Economics and Spatial Analysis",SSRN Electronic Journal,article,Richard Sander,https://openalex.org/A5043196054,American Community Survey; UCLA RDC; FSRDC; Decennial Census; Census Bureau,Decennial Census,UCLA,1059,"Black Pioneers, Intermetropolitan Movers, and Housing Desegregation",100
"Black Pioneers, Intermetropolitan Movers, and Housing Desegregation",,"In this project, we examine the mobility choices of black households between 1960 and 2000. We use household-level Decennial Census data geocoded down to the census tract level. Our results indicate that, for black households, one’s status as an intermetropolitan migrant – especially from an urban area outside the South – is a powerful predictor of pioneering into a white neighborhood. Moreover, and perhaps even more importantly, the ratio of these intermetropolitan black arrivals to the incumbent metropolitan black population is a powerful predictor of whether a metropolitan area experiences substantial declines in housing segregation.",2016,2016-03-01,0,"{'Richard H. Sander', 'Yana A. Kucheva'}",,"Urban, Neighborhood, and Segregation Studies; Housing Market and Economics; Regional Economics and Spatial Analysis",RePEc: Research Papers in Economics,preprint,Richard Sander,https://openalex.org/A5043196054,American Community Survey; UCLA RDC; FSRDC; Decennial Census; Census Bureau,Decennial Census,UCLA,1059,"Black Pioneers, Intermetropolitan Movers, and Housing Desegregation",100
Computationally efficient Bayesian unit-level models for non-Gaussian data under informative sampling with application to estimation of health insurance coverage,https://doi.org/10.1214/21-aoas1524,"Statistical estimates from survey samples have traditionally been obtained via design-based estimators. In many cases these estimators tend to work well for quantities, such as population totals or means, but can fall short as sample sizes become small. In today's ""information age,"" there is a strong demand for more granular estimates. To meet this demand, using a Bayesian pseudolikelihood, we propose a computationally efficient unit-level modeling approach for non-Gaussian data collected under informative sampling designs. Specifically, we focus on binary and multinomial data. Our approach is both multivariate and multiscale, incorporating spatial dependence at the area level. We illustrate our approach through an empirical simulation study and through a motivating application to health insurance estimates, using the American Community Survey.",2022,2022-06-01,7,"{'Ryan Janicki', 'Scott H. Holan', 'Paul A. Parker'}",University of Missouri; University of Missouri; United States Census Bureau; United States Census Bureau,Statistical Methods and Bayesian Inference; demographic modeling and climate adaptation; Bayesian Methods and Mixture Models,The Annals of Applied Statistics,article,Ryan Janicki,https://openalex.org/A5039045374,American Community Survey; Missouri RDC; Master Address File Extract; FSRDC; Census Bureau,American Community Survey,Missouri,848,Computationally Efficient Bayesian Unit-Level Models for Non-Gaussian Data Under Informative Sampling with Application to Estimation of Health Insurance Coverage,100
Unit Level Modeling of Survey Data for Small Area Estimation Under Informative Sampling: A Comprehensive Overview with Extensions,https://doi.org/10.48550/arxiv.1908.10488,"Model-based small area estimation is frequently used in conjunction with survey data in order to establish estimates for under-sampled or unsampled geographies. These models can be specified at either the area-level, or the unit-level, but unit-level models often offer potential advantages such as more precise estimates and easy spatial aggregation. Nevertheless, relative to area-level models, literature on unit-level models is less prevalent. In modeling small areas at the unit level, challenges often arise as a consequence of the informative sampling mechanism used to collect the survey data. This paper provides a comprehensive methodological review for unit-level models under informative sampling, with an emphasis on Bayesian approaches. To provide insight into the differences between methods, we conduct a simulation study that compares several of the described approaches. In addition, the methods used for simulation are further illustrated through an application to the American Community Survey. Finally, we present several extensions and areas for future research.",2019,2019-01-01,8,"{'Scott H. Holan', 'Ryan Janicki', 'Paul A. Parker'}",,demographic modeling and climate adaptation; Statistical Methods and Bayesian Inference; Spatial and Panel Data Analysis,arXiv (Cornell University),preprint,Ryan Janicki,https://openalex.org/A5039045374,American Community Survey; Missouri RDC; Master Address File Extract; FSRDC; Census Bureau,American Community Survey,Missouri,850,Unit Level Modeling of Survey Data for Small Area Estimation Under Informative Sampling: A Comprehensive Overview with Extensions,100
Comparison of Unit-Level Small Area Estimation Modeling Approaches for Survey Data Under Informative Sampling,https://doi.org/10.1093/jssam/smad022,"Abstract Unit-level modeling strategies offer many advantages relative to the area-level models that are most often used in the context of small area estimation. For example, unit-level models aggregate naturally, allowing for estimates at any desired resolution, and also offer greater precision in many cases. We compare a variety of the methods available in the literature related to unit-level modeling for small area estimation. Specifically, to provide insight into the differences between methods, we conduct a simulation study that compares several of the general approaches. In addition, the methods used for simulation are further illustrated through an application to the American Community Survey.",2023,2023-06-14,4,"{'Scott H. Holan', 'Ryan Janicki', 'Paul A. Parker'}","University of California, Santa Cruz; United States Census Bureau; United States Census Bureau; University of Missouri",demographic modeling and climate adaptation; Statistical Methods and Bayesian Inference; Spatial and Panel Data Analysis,Journal of Survey Statistics and Methodology,article,Ryan Janicki,https://openalex.org/A5039045374,American Community Survey; Missouri RDC; Master Address File Extract; FSRDC; Census Bureau,American Community Survey,Missouri,849,Comparison of Unit Level Small Area Estimation Modeling Approaches for Survey Data Under Informative Sampling,100
Gains from Offshoring? Evidence from U.S. Microdata,https://doi.org/10.2139/ssrn.2252160,"We construct a new linked data set with over one thousand offshoring events by matching Trade Adjustment Assistance program petition data to micro-data from the U.S. Census Bureau. We exploit this data to assess how offshoring impacts domestic firm-level aggregate employment, output, wages and productivity. A class of models predicts that more productive firms engage in offshoring, and that this leads to gains in output and (measured) productivity, and potential gains in employment and wages, in the remaining domestic activities of the offshoring firm. Consistent with these models, we find that offshoring firms are on average larger and more productive compared to non-offshorers. However, we find that offshorers suffer from a large decline in employment (32 per cent) and output (28 per cent) relative to their peers even in the long run. Further, we find no significant change in average wages or in total factor productivity measures at affected firms. We find these results robust to a variety of checks. Thus we find no evidence for positive spillovers to the remaining domestic activity of firms in this large sample of offshoring events.",2013,2013-01-01,4,"{'Ryan Monarch', 'Jooyoun Park', 'Jagadeesh Sivadasan'}",Federal Reserve; Federal Reserve Board of Governors; Kent State University; University of Michigan–Ann Arbor; Ross School,Outsourcing and Supply Chain Management; Global trade and economics; Firm Innovation and Growth,SSRN Electronic Journal,article,Ryan P Monarch,https://openalex.org/A5004737110,Survey of Plant Capacity Utilization; Foreign Trade Data - Import; Census Bureau,Census Bureau,Michigan,479,Gains from Offshoring? Evidence from U.S. Microdata,100
Gains from Offshoring? Evidence from New U.S. Microdata,https://doi.org/10.2139/ssrn.2211571,"We construct a new linked data set with over one thousand offshoring events by matching Trade Adjustment Assistance program petition data to micro-data from the U.S. Census Bureau. We exploit this data to assess how offshoring impacts domestic firm-level aggregate employment, output, wages and productivity. A class of models predicts that more productive firms engage in offshoring, and that this leads to gains in output and (measured) productivity, and potential gains in employment and wages, in the remaining domestic activities of the offshoring firm. Consistent with these models, we find that offshoring firms are on average larger and more productive compared to non-offshorers. However, we find that offshorers suffer from a large decline in employment (32 percent) and output (28 percent) relative to their peers even in the long run. Further, we find no significant change in average wages or in total factor productivity measures at affected firms. We find these results robust to a variety of checks. Thus we find no evidence for positive spillovers to the remaining domestic activity of firms in this large sample of offshoring events.",2013,2013-01-01,1,"{'Ryan Monarch', 'Jooyoun Park', 'Jagadeesh Sivadasan'}",Federal Reserve Board of Governors; Federal Reserve; Kent State University; University of Michigan–Ann Arbor; Ross School,Outsourcing and Supply Chain Management; Global trade and economics; Firm Innovation and Growth,SSRN Electronic Journal,article,Ryan P Monarch,https://openalex.org/A5004737110,Survey of Plant Capacity Utilization; Foreign Trade Data - Import; Census Bureau,Census Bureau,Michigan,479,Gains from Offshoring? Evidence from U.S. Microdata,96
The Volume Of TV Advertisements During The ACA’s First Enrollment Period Was Associated With Increased Insurance Coverage,https://doi.org/10.1377/hlthaff.2016.1440,"The launch of the Affordable Care Act was accompanied by major insurance information campaigns by government, nonprofit, political, news media, and private-sector organizations, but it is not clear to what extent these efforts were associated with insurance gains. Using county-level data from the Census Bureau’s American Community Survey and broadcast television airings data from the Wesleyan Media Project, we examined the relationship between insurance advertisements and county-level health insurance changes between 2013 and 2014, adjusting for other media and county- and state-level characteristics. We found that counties exposed to higher volumes of local insurance advertisements during the first open enrollment period experienced larger reductions in their uninsurance rates than other counties. State-sponsored advertisements had the strongest relationship with declines in uninsurance, and this relationship was driven by increases in Medicaid enrollment. These results support the importance of strategic investment in advertising to increase uptake of health insurance but suggest that not all types of advertisements will have the same effect on the public.",2017,2017-03-16,30,"{'Sarah E. Gollust', 'Erika Franklin Fowler', 'Andrew D. Wilcock', 'Pinar Karaca‐Mandic', 'Colleen L. Barry', 'Laura Baum', 'Jeff Niederdeppe'}",University of Minnesota; University of Minnesota; Wesleyan University; Johns Hopkins University; Wesleyan University; Cornell University; University of Minnesota,Healthcare Policy and Management; Primary Care and Health Outcomes; Patient Satisfaction in Healthcare,Health Affairs,article,Sarah Gollust,https://openalex.org/A5080260252,Minnesota RDC; American Community Survey; FSRDC; Census Bureau,American Community Survey; Census Bureau,Minnesota,1209,The volume of TV advertisements during the ACA’s first enrollment period was associated with increased insurance coverage,100
The Dynamics of Gender Earnings Differentials: Evidence from Establishment Data,https://doi.org/10.3386/w23381,"Despite dramatic workforce gains by women in recent decades, a substantial gender earnings gap persists and widens over the course of men's and women's careers.Since there are earnings differences across establishments, a key question is the extent to which the widening of the gender pay gap over time arises from differences in career advances within the same establishment versus differential gains from job-to-job moves across establishments.Using a unique match between the 2000 Decennial Census of the United States and the Longitudinal Employer Household Dynamics (LEHD) data, we find that both channels are important and affect workers differently by education.For the college-educated the increasing gap is for the most part due to differential earnings growth within establishment.The between-establishment component explains only 27 percent of the widening of the total gender pay gap for this group.For workers without college degree, the establishment component is the main driver of the, relatively small, widening of the gender earnings gap.For both education groups, marriage plays a crucial role in the establishment component of the increasing earnings gap.",2017,2017-05-01,27,"{'Claudia Olivetti', 'Erling Barth', 'Sari Pekkala Kerr'}",Dartmouth College; National Bureau of Economic Research; Forskning.no (Norway); Institute for Social Research; Wellesley College; Dartmouth College; National Bureau of Economic Research; Forskning.no (Norway); Institute for Social Research; Wellesley College; Dartmouth College; Forskning.no (Norway); National Bureau of Economic Research; Institute for Social Research; Wellesley College,"Corporate Finance and Governance; Gender, Labor, and Family Dynamics",,report,Sari Kerr,https://openalex.org/A5003192480,Supplementary Public Data - County Characteristics; Decennial Census,Decennial Census,Boston,594,The Dynamics of Gender Earnings Differentials: Evidence from Establishment Data,100
The Dynamics of Gender Earnings Differentials: Evidence from Establishment Data,https://doi.org/10.2139/ssrn.3029846,"We use a unique match between the 2000 Decennial Census of the United States and the Longitudinal Employer Household Dynamics (LEHD) data to analyze how much of the increase in the gender earnings gap over the lifecycle comes from shifts in the sorting of men and women across high- and low-pay establishments and how much is due to differential earnings growth within establishments. We find that for the college educated the increase is substantial and, for the most part, due to differential earnings growth within establishment by gender. The between component is also important. Differential mobility between establishments by gender can explain 27 percent of the widening of the pay gap for this group. For those with no college the relatively small increase of the gender gap over the lifecycle can be fully explained by differential moves by gender across establishments. The evidence suggests that, for both education groups, the between-establishment component of the increasing wage gap is due almost entirely to those who are married.",2017,2017-01-01,25,"{'Claudia Olivetti', 'Erling Barth', 'Sari Pekkala Kerr'}",University of Oslo; Institute for Social Research; IZA - Institute of Labor Economics; Charles River Associates; National Bureau of Economic Research; Boston College,"Labor market dynamics and wage inequality; Gender, Labor, and Family Dynamics",SSRN Electronic Journal,article,Sari Kerr,https://openalex.org/A5003192480,Supplementary Public Data - County Characteristics; Decennial Census,Decennial Census,Boston,594,The Dynamics of Gender Earnings Differentials: Evidence from Establishment Data,100
Age at Immigrant Arrival and Career Mobility: Evidence from Vietnamese Refugee Migration and the Amerasian Homecoming Act,https://doi.org/10.3386/w32067,"We study the long-run career mobility of young immigrants, mostly refugees, from Vietnam who moved to the United States during 1989-1995.This third and final migration wave of young Vietnamese immigrants was sparked by unexpected events that culminated in the Amerasian Homecoming Act.Characteristics of the wave also minimized selection effects regarding who migrated.Small differences in the age at arrival, specifically being 14-17 years old on entry compared to 18-21, resulted in substantial differences in future economic outcomes.Using Census Bureau data, we characterize the different career profiles of young vs. older immigrants, and we quantify explanatory factors like education, language fluency, and persistence from initial employers.",2024,2024-01-01,1,"{'William R. Kerr', 'Sari Pekkala Kerr', 'Kendall A. Smith'}",U.S. National Science Foundation; London Business School; National Bureau of Economic Research; Dana-Farber/Harvard Cancer Center; Wellesley College; U.S. National Science Foundation; London Business School; National Bureau of Economic Research; Dana-Farber/Harvard Cancer Center; Wellesley College; U.S. National Science Foundation; London Business School; National Bureau of Economic Research; Dana-Farber/Harvard Cancer Center; Wellesley College,"Migration and Labor Dynamics; Employment and Welfare Studies; Retirement, Disability, and Employment",,report,Sari Kerr,https://openalex.org/A5003192480,Survey of Plant Capacity Utilization; Service Annual Survey; Census Bureau,Census Bureau,Boston,1243,Age at Immigrant Arrival and Career Mobility: Evidence from Vietnamese Refugee Migration and the Amerasian Homecoming Act,100
Age at Immigrant Arrival and Career Mobility: Evidence from Vietnamese Refugee Migration and the Amerasian Homecoming Act,https://doi.org/10.2139/ssrn.4702281,"We study the long-run career mobility of young immigrants, mostly refugees, from Vietnam who moved to the United States during 1989-1995. This third and final migration wave of young Vietnamese immigrants was sparked by unexpected events that culminated in the Amerasian Homecoming Act. Characteristics of the wave also minimized selection effects regarding who migrated. Small differences in the age at arrival, specifically being 14-17 years old on entry compared to 18-21, resulted in substantial differences in future economic outcomes. Using Census Bureau data, we characterize the different career profiles of young vs. older immigrants, and we quantify explanatory factors like education, language fluency, and persistence from initial employers.Institutional subscribers to the NBER working paper series, and residents of developing countries may download this paper without additional charge at www.nber.org.",2024,2024-01-01,0,"{'William R. Kerr', 'Sari Pekkala Kerr', 'Kendall A. Smith'}",Wellesley College; Entrepreneurial Ecosystems; Harvard University; London Business School,"Migration and Labor Dynamics; Migration, Ethnicity, and Economy; Labor market dynamics and wage inequality",SSRN Electronic Journal,article,Sari Kerr,https://openalex.org/A5003192480,Survey of Plant Capacity Utilization; Service Annual Survey; Census Bureau,Census Bureau,Boston,1243,Age at Immigrant Arrival and Career Mobility: Evidence from Vietnamese Refugee Migration and the Amerasian Homecoming Act,100
Public-Use vs. Restricted-Use: An Analysis Using the American Community Survey,https://doi.org/10.2139/ssrn.2909935,"Statistical agencies frequently publish microdata that have been altered to protect confidentiality. Such data retain utility for many types of broad analyses but can yield biased or insufficiently precise results in others. Research access to de-identified versions of the restricted-use data with little or no alteration is often possible, albeit costly and time-consuming. We investigate the advantages and disadvantages of public-use and restricted-use data from the American Community Survey (ACS) in constructing a wage index. The public-use data used were Public Use Microdata Samples, while the restricted-use data were accessed via a Federal Statistical Research Data Center. We discuss the advantages and disadvantages of each data source and compare estimated CWIs and standard errors at the state and labor market levels.",2017,2017-01-01,5,"{'Satkartar K. Kinney', 'Alan F. Karr'}",RTI International; RTI International,"Healthcare Policy and Management; Income, Poverty, and Inequality; Food Security and Health in Diverse Populations",SSRN Electronic Journal,article,Satkartar Kinney,https://openalex.org/A5051148741,American Community Survey; Standard Statistical Establishment List - non Name and Address File; Census of Retail Trade,American Community Survey,Triangle,879,Public-Use vs. Restricted-Use: An Analysis Using the American Community Survey,100
